{"$schema":"https://json-schema.org/draft/2020-12/schema","additionalProperties":false,"properties":{"authority_type":{"const":"required_evidence_policy"},"policy_id":{"minLength":1,"type":"string"},"rules":{"items":{"additionalProperties":false,"properties":{"artifact_class":{"enum":["runtime-log"],"type":"string"},"capture_pass_rule":{"minLength":1,"type":"string"},"cardinality":{"const":2,"type":"integer"},"conditional_rule":{"minLength":1,"type":"string"},"immutability_rule":{"minLength":1,"type":"string"},"required_classes":{"items":{"minLength":1,"type":"string"},"minItems":2,"type":"array","uniqueItems":true},"required_for_recovery":{"const":true},"required_roles":{"items":{"minLength":1,"type":"string"},"minItems":2,"type":"array","uniqueItems":true},"semantic_purpose":{"minLength":1,"type":"string"},"source_attempt_rule":{"minLength":1,"type":"string"}},"required":["artifact_class","capture_pass_rule","cardinality","conditional_rule","immutability_rule","required_classes","required_for_recovery","required_roles","semantic_purpose","source_attempt_rule"],"type":"object"},"minItems":1,"type":"array"},"schema_version":{"const":"6.0.0-DRAFT"}},"required":["authority_type","policy_id","rules","schema_version"],"title":"R4 required evidence policy","type":"object"}
