{"authority_type":"required_evidence_policy","policy_id":"RANDLE-R4-REQUIRED-EVIDENCE-1","rules":[{"artifact_class":"runtime-log","capture_pass_rule":"SAME_AUTHORIZED_FIXTURE_PASS","cardinality":2,"conditional_rule":"ALWAYS_FOR_SEPARATE_RUNTIME_LOG","immutability_rule":"CONTENT_ADDRESSED_IMMUTABLE","required_classes":["content-hash","path-authority"],"required_for_recovery":true,"required_roles":["historical-content","historical-path"],"semantic_purpose":"PRESERVE_HISTORICAL_TEST_OUTCOME_AUTHORITY","source_attempt_rule":"SAME_AUTHORIZED_ATTEMPT"}],"schema_version":"6.0.0-DRAFT"}
